	192.168.0.4	54.230.131.46	19769,80	[TCP segment of a reassembled PDU]
	192.168.0.6	192.168.0.4	62862,41440	62862 > 41440 [PSH, ACK] Seq=1 Ack=1 Win=4181 Len=8
	54.230.131.46	192.168.0.4	80,19769	http > 19769 [ACK] Seq=1 Ack=2 Win=62 Len=0 SLE=1 SRE=2
	192.168.0.4	192.168.0.6	41440,62862	41440 > 62862 [ACK] Seq=1 Ack=9 Win=65 Len=0
	74.125.68.189	192.168.0.4	443,19710	Application Data
	192.168.0.4	74.125.68.189	19710,443	19710 > https [ACK] Seq=1 Ack=60 Win=62 Len=0
	192.168.0.4	54.230.129.151	19781,80	[TCP segment of a reassembled PDU]
	54.230.129.151	192.168.0.4	80,19781	http > 19781 [ACK] Seq=1 Ack=2 Win=62 Len=0 SLE=1 SRE=2
	108.160.167.162	192.168.0.4	443,19856	Application Data
	192.168.0.4	108.160.167.162	19856,443	Application Data, Application Data
	192.168.0.4	46.101.21.78	19810,80	[TCP segment of a reassembled PDU]
	108.160.167.162	192.168.0.4	443,19856	https > 19856 [ACK] Seq=326 Ack=411 Win=35 Len=0
	143.127.93.89	192.168.0.4	80,19806	http > 19806 [ACK] Seq=1 Ack=1 Win=11680 Len=0
	192.168.0.4	143.127.93.89	19806,80	[TCP ACKed unseen segment] 19806 > http [ACK] Seq=1 Ack=2 Win=64 Len=0
	46.101.21.78	192.168.0.4	80,19810	http > 19810 [ACK] Seq=1 Ack=2 Win=119 Len=0 SLE=1 SRE=2
	192.168.0.6	192.168.0.4	62863,41440	62863 > 41440 [PSH, ACK] Seq=1 Ack=1 Win=4188 Len=69
	143.127.93.89	192.168.0.4	80,19806	[TCP Previous segment not captured] http > 19806 [ACK] Seq=2 Ack=1 Win=6 Len=0
	192.168.0.4	192.168.0.6	41440,62863	41440 > 62863 [ACK] Seq=1 Ack=70 Win=67 Len=0
	192.168.0.4	54.230.129.151	19779,80	[TCP segment of a reassembled PDU]
	192.168.0.4	46.101.21.78	19809,80	[TCP segment of a reassembled PDU]
	54.230.129.151	192.168.0.4	80,19779	http > 19779 [ACK] Seq=1 Ack=2 Win=62 Len=0 SLE=1 SRE=2
	46.101.21.78	192.168.0.4	80,19809	http > 19809 [ACK] Seq=1 Ack=2 Win=119 Len=0 SLE=1 SRE=2
	192.168.0.4	74.125.130.16	19887,993	19887 > imaps [SYN] Seq=0 Win=8192 Len=0 MSS=1460 WS=256 SACK_PERM=1
	192.168.0.4	192.168.0.1		Standard query 0x8701  A imap.googlemail.com
	74.125.130.16	192.168.0.4	993,19887	imaps > 19887 [RST, ACK] Seq=1 Ack=1 Win=8192 Len=0
	192.168.0.1	192.168.0.4		Standard query response 0x8701  CNAME googlemail-imap.l.google.com A 74.125.68.16
	192.168.0.4	23.206.96.48	19850,443	Continuation Data
	192.168.0.4	192.168.0.1		Standard query 0x9999  A www.vox.com
	192.168.0.4	54.209.102.182	19888,80	19888 > http [SYN] Seq=0 Win=8192 Len=0 MSS=1460 WS=256 SACK_PERM=1
	192.168.0.4	192.168.0.1		Standard query 0xc63e  A www.vox.com
	23.206.96.48	192.168.0.4	443,19850	https > 19850 [ACK] Seq=1 Ack=2 Win=524 Len=0 SLE=1 SRE=2
	192.168.0.1	192.168.0.4		Standard query response 0xc63e  CNAME proxy-vox-com-elb-1190495038.us-east-1.elb.amazonaws.com A 54.209.102.182 A 54.173.214.122
	192.168.0.1	192.168.0.4		Standard query response 0x9999  CNAME proxy-vox-com-elb-1190495038.us-east-1.elb.amazonaws.com A 54.209.102.182 A 54.173.214.122
	192.168.0.4	54.209.102.182	19889,80	19889 > http [SYN] Seq=0 Win=8192 Len=0 MSS=1460 WS=256 SACK_PERM=1
	54.209.102.182	192.168.0.4	80,19888	http > 19888 [SYN, ACK] Seq=0 Ack=1 Win=17922 Len=0 MSS=1380 SACK_PERM=1 WS=256
	192.168.0.4	54.209.102.182	19888,80	19888 > http [ACK] Seq=1 Ack=1 Win=16384 Len=0
	192.168.0.4	54.209.102.182	19888,80	GET /a/maps-explain-the-middle-east HTTP/1.1 
	192.168.0.4	74.125.130.16	19887,993	[TCP Retransmission] 19887 > imaps [SYN] Seq=0 Win=8192 Len=0 MSS=1460 WS=256 SACK_PERM=1
	74.125.130.16	192.168.0.4	993,19887	imaps > 19887 [RST, ACK] Seq=1 Ack=1 Win=8192 Len=0
	192.168.0.4	54.230.129.198	19777,80	[TCP segment of a reassembled PDU]
	54.209.102.182	192.168.0.4	80,19889	http > 19889 [SYN, ACK] Seq=0 Ack=1 Win=17922 Len=0 MSS=1380 SACK_PERM=1 WS=256
	192.168.0.4	54.209.102.182	19889,80	19889 > http [ACK] Seq=1 Ack=1 Win=16384 Len=0
	54.209.102.182	192.168.0.4	80,19888	http > 19888 [ACK] Seq=1 Ack=717 Win=19456 Len=0
	54.209.102.182	192.168.0.4	80,19888	[TCP segment of a reassembled PDU]
	54.209.102.182	192.168.0.4	80,19888	[TCP segment of a reassembled PDU]
	192.168.0.4	54.209.102.182	19888,80	19888 > http [ACK] Seq=717 Ack=2761 Win=16384 Len=0
	54.209.102.182	192.168.0.4	80,19888	[TCP segment of a reassembled PDU]
	54.209.102.182	192.168.0.4	80,19888	[TCP segment of a reassembled PDU]
	192.168.0.4	54.209.102.182	19888,80	19888 > http [ACK] Seq=717 Ack=5521 Win=16384 Len=0
	54.209.102.182	192.168.0.4	80,19888	[TCP segment of a reassembled PDU]
	54.209.102.182	192.168.0.4	80,19888	[TCP segment of a reassembled PDU]
	192.168.0.4	54.209.102.182	19888,80	19888 > http [ACK] Seq=717 Ack=8281 Win=16384 Len=0
	54.209.102.182	192.168.0.4	80,19888	[TCP segment of a reassembled PDU]
	54.209.102.182	192.168.0.4	80,19888	[TCP segment of a reassembled PDU]
	192.168.0.4	54.209.102.182	19888,80	19888 > http [ACK] Seq=717 Ack=11041 Win=16384 Len=0
	54.209.102.182	192.168.0.4	80,19888	[TCP segment of a reassembled PDU]
	192.168.0.4	192.168.0.1		Standard query 0x4720  A ea-cdn.voxmedia.com
	192.168.0.4	192.168.0.1		Standard query 0xcc67  A ea-cdn.voxmedia.com
	192.168.0.4	192.168.0.1		Standard query 0x1a56  A ajax.googleapis.com
	192.168.0.4	216.58.196.10	19890,80	19890 > http [SYN] Seq=0 Win=8192 Len=0 MSS=1460 WS=256 SACK_PERM=1
	192.168.0.4	192.168.0.1		Standard query 0x4d42  A ajax.googleapis.com
	192.168.0.4	192.168.0.1		Standard query 0xd039  A cdnjs.cloudflare.com
	192.168.0.4	192.168.0.1		Standard query 0xdaa7  A cdnjs.cloudflare.com
	192.168.0.4	192.168.0.1		Standard query 0x1852  A ox-d.sbnation.com
	192.168.0.4	192.168.0.1		Standard query 0x2cf9  A ox-d.sbnation.com
	54.209.102.182	192.168.0.4	80,19888	[TCP segment of a reassembled PDU]
	54.230.129.198	192.168.0.4	80,19777	http > 19777 [ACK] Seq=1 Ack=2 Win=62 Len=0 SLE=1 SRE=2
	192.168.0.4	54.209.102.182	19888,80	19888 > http [ACK] Seq=717 Ack=13801 Win=16384 Len=0
	192.168.0.1	192.168.0.4		Standard query response 0x1a56  CNAME googleapis.l.google.com A 216.58.196.10
	192.168.0.4	192.168.0.1		Standard query 0xde6c  A cdn0.vox-cdn.com
	192.168.0.4	54.230.131.46	19769,80	Continuation or non-HTTP traffic
	192.168.0.1	192.168.0.4		Standard query response 0x4d42  CNAME googleapis.l.google.com A 216.58.196.10
	192.168.0.4	192.168.0.1		Standard query 0x6025  A cdn3.vox-cdn.com
	192.168.0.1	192.168.0.4		Standard query response 0xd039  CNAME cdnjs.cloudflare.com.cdn.cloudflare.net A 198.41.215.8 A 198.41.214.7 A 198.41.214.8 A 198.41.215.6 A 198.41.215.7
	192.168.0.4	192.168.0.1		Standard query 0xba65  A cdn3.vox-cdn.com
	216.58.196.10	192.168.0.4	80,19890	http > 19890 [SYN, ACK] Seq=0 Ack=1 Win=42900 Len=0 MSS=1380 SACK_PERM=1 WS=128
	192.168.0.4	216.58.196.10	19890,80	19890 > http [ACK] Seq=1 Ack=1 Win=16384 Len=0
	192.168.0.4	216.58.196.10	19890,80	GET /ajax/libs/jquery/1.10.2/jquery.min.js HTTP/1.1 
	192.168.0.1	192.168.0.4		Standard query response 0xdaa7  CNAME cdnjs.cloudflare.com.cdn.cloudflare.net A 198.41.215.7 A 198.41.215.8 A 198.41.214.7 A 198.41.214.8 A 198.41.215.6
	192.168.0.4	192.168.0.1		Standard query 0xf0fa  A cdn2.vox-cdn.com
	192.168.0.4	198.41.214.7	19891,80	19891 > http [SYN] Seq=0 Win=8192 Len=0 MSS=1460 WS=256 SACK_PERM=1
	192.168.0.4	198.41.214.7	19892,80	19892 > http [SYN] Seq=0 Win=8192 Len=0 MSS=1460 WS=256 SACK_PERM=1
	192.168.0.1	192.168.0.4		Standard query response 0xf0fa  CNAME ddrgqsxlcy7wq.cloudfront.net A 54.192.128.118 A 54.192.129.19 A 54.192.130.179 A 54.230.129.151 A 54.230.129.198 A 54.230.131.46 A 54.192.128.31 A 54.192.128.61
	192.168.0.1	192.168.0.4		Standard query response 0xde6c  CNAME ddrgqsxlcy7wq.cloudfront.net A 54.192.128.118 A 54.192.129.19 A 54.192.130.179 A 54.230.129.151 A 54.230.129.198 A 54.230.131.46 A 54.192.128.31 A 54.192.128.61
	192.168.0.1	192.168.0.4		Standard query response 0xcc67  CNAME d8wuu9msfgurd.cloudfront.net A 54.192.128.169 A 54.192.130.47 A 54.192.130.231 A 54.192.131.227 A 54.230.128.2 A 54.230.129.198 A 54.230.131.167 A 54.240.184.64
	192.168.0.1	192.168.0.4		Standard query response 0x4720  CNAME d8wuu9msfgurd.cloudfront.net A 54.192.128.169 A 54.192.130.47 A 54.192.130.231 A 54.192.131.227 A 54.230.128.2 A 54.230.129.198 A 54.230.131.167 A 54.240.184.64
	192.168.0.4	54.230.128.2	19893,80	19893 > http [SYN] Seq=0 Win=8192 Len=0 MSS=1460 WS=256 SACK_PERM=1
	192.168.0.4	54.230.128.2	19894,80	19894 > http [SYN] Seq=0 Win=8192 Len=0 MSS=1460 WS=256 SACK_PERM=1
	192.168.0.4	54.230.128.2	19895,80	19895 > http [SYN] Seq=0 Win=8192 Len=0 MSS=1460 WS=256 SACK_PERM=1
	192.168.0.4	54.230.128.2	19896,80	19896 > http [SYN] Seq=0 Win=8192 Len=0 MSS=1460 WS=256 SACK_PERM=1
	192.168.0.1	192.168.0.4		Standard query response 0x6025  CNAME ddrgqsxlcy7wq.cloudfront.net A 54.192.128.61 A 54.192.128.118 A 54.192.129.19 A 54.192.130.179 A 54.230.129.151 A 54.230.129.198 A 54.230.131.46 A 54.192.128.31
	216.58.196.10	192.168.0.4	80,19890	http > 19890 [ACK] Seq=1 Ack=339 Win=44032 Len=0
	192.168.0.1	192.168.0.4		Standard query response 0xba65  CNAME ddrgqsxlcy7wq.cloudfront.net A 54.192.128.31 A 54.192.128.61 A 54.192.128.118 A 54.192.129.19 A 54.192.130.179 A 54.230.129.151 A 54.230.129.198 A 54.230.131.46
	192.168.0.4	54.230.129.151	19897,80	19897 > http [SYN] Seq=0 Win=8192 Len=0 MSS=1460 WS=256 SACK_PERM=1
	192.168.0.4	74.125.130.16	19887,993	[TCP Retransmission] 19887 > imaps [SYN] Seq=0 Win=8192 Len=0 MSS=1460 SACK_PERM=1
	216.58.196.10	192.168.0.4	80,19890	[TCP segment of a reassembled PDU]
	216.58.196.10	192.168.0.4	80,19890	[TCP segment of a reassembled PDU]
	192.168.0.4	216.58.196.10	19890,80	19890 > http [ACK] Seq=339 Ack=2761 Win=16384 Len=0
	216.58.196.10	192.168.0.4	80,19890	[TCP segment of a reassembled PDU]
	216.58.196.10	192.168.0.4	80,19890	[TCP segment of a reassembled PDU]
	192.168.0.4	216.58.196.10	19890,80	19890 > http [ACK] Seq=339 Ack=5521 Win=16384 Len=0
	216.58.196.10	192.168.0.4	80,19890	[TCP segment of a reassembled PDU]
	216.58.196.10	192.168.0.4	80,19890	[TCP segment of a reassembled PDU]
	192.168.0.4	216.58.196.10	19890,80	19890 > http [ACK] Seq=339 Ack=8281 Win=16384 Len=0
	216.58.196.10	192.168.0.4	80,19890	[TCP segment of a reassembled PDU]
	216.58.196.10	192.168.0.4	80,19890	[TCP segment of a reassembled PDU]
	192.168.0.4	216.58.196.10	19890,80	19890 > http [ACK] Seq=339 Ack=11041 Win=16384 Len=0
	216.58.196.10	192.168.0.4	80,19890	[TCP segment of a reassembled PDU]
	216.58.196.10	192.168.0.4	80,19890	[TCP segment of a reassembled PDU]
	192.168.0.4	216.58.196.10	19890,80	19890 > http [ACK] Seq=339 Ack=13801 Win=16384 Len=0
	192.168.0.1	192.168.0.4		Standard query response 0x2cf9  CNAME sbnation-d3.openxenterprise.com CNAME prod30-sbnation-d.d.xx.openx.com.akadns.net A 173.241.248.219
	192.168.0.4	173.241.248.219	19898,80	19898 > http [SYN] Seq=0 Win=8192 Len=0 MSS=1460 WS=256 SACK_PERM=1
	192.168.0.4	173.241.248.219	19899,80	19899 > http [SYN] Seq=0 Win=8192 Len=0 MSS=1460 WS=256 SACK_PERM=1
	198.41.214.7	192.168.0.4	80,19892	http > 19892 [SYN, ACK] Seq=0 Ack=1 Win=29200 Len=0 MSS=1380 SACK_PERM=1 WS=1024
	198.41.214.7	192.168.0.4	80,19891	http > 19891 [SYN, ACK] Seq=0 Ack=1 Win=29200 Len=0 MSS=1380 SACK_PERM=1 WS=1024
	192.168.0.4	198.41.214.7	19892,80	19892 > http [ACK] Seq=1 Ack=1 Win=16384 Len=0
	192.168.0.4	198.41.214.7	19891,80	19891 > http [ACK] Seq=1 Ack=1 Win=16384 Len=0
	192.168.0.1	192.168.0.4		Standard query response 0x1852  CNAME sbnation-d3.openxenterprise.com CNAME prod30-sbnation-d.d.xx.openx.com.akadns.net A 173.241.248.219
	192.168.0.4	198.41.214.7	19892,80	GET /ajax/libs/underscore.js/1.5.2/underscore-min.js HTTP/1.1 
	216.58.196.10	192.168.0.4	80,19890	[TCP segment of a reassembled PDU]
	216.58.196.10	192.168.0.4	80,19890	[TCP segment of a reassembled PDU]
	192.168.0.4	216.58.196.10	19890,80	19890 > http [ACK] Seq=339 Ack=16561 Win=16384 Len=0
	216.58.196.10	192.168.0.4	80,19890	[TCP segment of a reassembled PDU]
	216.58.196.10	192.168.0.4	80,19890	[TCP segment of a reassembled PDU]
	192.168.0.4	216.58.196.10	19890,80	19890 > http [ACK] Seq=339 Ack=19145 Win=16384 Len=0
	216.58.196.10	192.168.0.4	80,19890	[TCP segment of a reassembled PDU]
	216.58.196.10	192.168.0.4	80,19890	[TCP segment of a reassembled PDU]
	192.168.0.4	216.58.196.10	19890,80	19890 > http [ACK] Seq=339 Ack=20701 Win=16384 Len=0
	54.230.131.46	192.168.0.4	80,19769	http > 19769 [ACK] Seq=1 Ack=330 Win=66 Len=0
	54.230.131.46	192.168.0.4	80,19769	[TCP segment of a reassembled PDU]
	54.230.131.46	192.168.0.4	80,19769	HTTP/1.1 200 OK  (PNG)
	192.168.0.4	54.230.131.46	19769,80	19769 > http [ACK] Seq=330 Ack=2050 Win=479 Len=0
	216.58.196.10	192.168.0.4	80,19890	[TCP segment of a reassembled PDU]
	192.168.0.4	216.58.220.36	19839,443	Application Data
	192.168.0.4	216.58.220.36	19843,443	Application Data
	216.58.196.10	192.168.0.4	80,19890	[TCP segment of a reassembled PDU]
	192.168.0.4	216.58.196.10	19890,80	19890 > http [ACK] Seq=339 Ack=23461 Win=16384 Len=0
	216.58.196.10	192.168.0.4	80,19890	[TCP segment of a reassembled PDU]
	54.209.102.182	192.168.0.4	80,19888	[TCP segment of a reassembled PDU]
	54.209.102.182	192.168.0.4	80,19888	[TCP segment of a reassembled PDU]
	192.168.0.4	54.209.102.182	19888,80	19888 > http [ACK] Seq=717 Ack=16561 Win=16384 Len=0
	54.209.102.182	192.168.0.4	80,19888	[TCP segment of a reassembled PDU]
	216.58.196.10	192.168.0.4	80,19890	[TCP segment of a reassembled PDU]
	192.168.0.4	216.58.196.10	19890,80	19890 > http [ACK] Seq=339 Ack=26045 Win=16384 Len=0
	216.58.196.10	192.168.0.4	80,19890	[TCP segment of a reassembled PDU]
	192.168.0.4	54.230.128.2	19900,80	19900 > http [SYN] Seq=0 Win=8192 Len=0 MSS=1460 WS=256 SACK_PERM=1
	192.168.0.4	54.230.128.2	19901,80	19901 > http [SYN] Seq=0 Win=8192 Len=0 MSS=1460 WS=256 SACK_PERM=1
	192.168.0.4	54.230.128.2	19902,80	19902 > http [SYN] Seq=0 Win=8192 Len=0 MSS=1460 WS=256 SACK_PERM=1
	54.209.102.182	192.168.0.4	80,19888	[TCP segment of a reassembled PDU]
	192.168.0.4	54.230.128.2	19903,80	19903 > http [SYN] Seq=0 Win=8192 Len=0 MSS=1460 WS=256 SACK_PERM=1
	192.168.0.4	54.209.102.182	19888,80	19888 > http [ACK] Seq=717 Ack=19321 Win=77056 Len=0
	192.168.0.4	54.230.129.151	19904,80	19904 > http [SYN] Seq=0 Win=8192 Len=0 MSS=1460 WS=256 SACK_PERM=1
	54.209.102.182	192.168.0.4	80,19888	[TCP segment of a reassembled PDU]
	216.58.196.10	192.168.0.4	80,19890	[TCP segment of a reassembled PDU]
	192.168.0.4	216.58.196.10	19890,80	19890 > http [ACK] Seq=339 Ack=27601 Win=16384 Len=0
	54.209.102.182	192.168.0.4	80,19888	[TCP segment of a reassembled PDU]
	192.168.0.4	54.209.102.182	19888,80	19888 > http [ACK] Seq=717 Ack=22081 Win=75776 Len=0
	54.209.102.182	192.168.0.4	80,19888	[TCP segment of a reassembled PDU]
	54.209.102.182	192.168.0.4	80,19888	[TCP segment of a reassembled PDU]
	192.168.0.4	54.209.102.182	19888,80	19888 > http [ACK] Seq=717 Ack=24841 Win=75776 Len=0
	54.209.102.182	192.168.0.4	80,19888	[TCP segment of a reassembled PDU]
	192.168.0.4	192.168.0.1		Standard query 0xbe93  A cdn.jsdelivr.net
	192.168.0.4	192.168.0.1		Standard query 0xca15  A cdn.jsdelivr.net
	192.168.0.4	54.230.128.2	19905,80	19905 > http [SYN] Seq=0 Win=8192 Len=0 MSS=1460 WS=256 SACK_PERM=1
	54.209.102.182	192.168.0.4	80,19888	HTTP/1.1 200 OK  (text/html)
	192.168.0.4	54.209.102.182	19888,80	19888 > http [ACK] Seq=717 Ack=26936 Win=73728 Len=0
	192.168.0.4	192.168.0.1		Standard query 0xa553  A edge.quantserve.com
	216.58.196.10	192.168.0.4	80,19890	[TCP segment of a reassembled PDU]
	216.58.196.10	192.168.0.4	80,19890	[TCP segment of a reassembled PDU]
	192.168.0.4	216.58.196.10	19890,80	19890 > http [ACK] Seq=339 Ack=30361 Win=16384 Len=0
	192.168.0.4	192.168.0.1		Standard query 0x25a5  A edge.quantserve.com
	216.58.196.10	192.168.0.4	80,19890	[TCP segment of a reassembled PDU]
	216.58.196.10	192.168.0.4	80,19890	[TCP segment of a reassembled PDU]
	54.230.128.2	192.168.0.4	80,19893	http > 19893 [SYN, ACK] Seq=0 Ack=1 Win=14600 Len=0 MSS=1380 SACK_PERM=1 WS=256
	192.168.0.4	216.58.196.10	19890,80	19890 > http [ACK] Seq=339 Ack=32945 Win=16384 Len=0
	192.168.0.4	54.230.128.2	19893,80	19893 > http [ACK] Seq=1 Ack=1 Win=16384 Len=0
	192.168.0.4	54.230.128.2	19893,80	GET /production/vox-40-maps/stylesheets/styles-dde012bd.css HTTP/1.1 
	54.230.128.2	192.168.0.4	80,19894	http > 19894 [SYN, ACK] Seq=0 Ack=1 Win=14600 Len=0 MSS=1380 SACK_PERM=1 WS=256
	54.230.128.2	192.168.0.4	80,19895	http > 19895 [SYN, ACK] Seq=0 Ack=1 Win=14600 Len=0 MSS=1380 SACK_PERM=1 WS=256
	192.168.0.4	54.230.128.2	19894,80	19894 > http [ACK] Seq=1 Ack=1 Win=16384 Len=0
	192.168.0.4	54.230.128.2	19895,80	19895 > http [ACK] Seq=1 Ack=1 Win=16384 Len=0
	192.168.0.4	54.230.128.2	19894,80	GET /production/vox-40-maps/javascripts/top-91c80ccb.js HTTP/1.1 
	192.168.0.4	54.230.128.2	19895,80	GET /production/vox-40-maps/javascripts/bottom-5cff2261.js HTTP/1.1 
	54.230.128.2	192.168.0.4	80,19896	http > 19896 [SYN, ACK] Seq=0 Ack=1 Win=14600 Len=0 MSS=1380 SACK_PERM=1 WS=256
	192.168.0.4	54.230.128.2	19896,80	19896 > http [ACK] Seq=1 Ack=1 Win=16384 Len=0
	216.58.196.10	192.168.0.4	80,19890	HTTP/1.1 200 OK  (text/javascript)
	54.230.129.151	192.168.0.4	80,19897	http > 19897 [SYN, ACK] Seq=0 Ack=1 Win=14600 Len=0 MSS=1380 SACK_PERM=1 WS=256
	192.168.0.4	54.230.129.151	19897,80	19897 > http [ACK] Seq=1 Ack=1 Win=16384 Len=0
	198.41.214.7	192.168.0.4	80,19892	http > 19892 [ACK] Seq=1 Ack=350 Win=30720 Len=0
	216.58.220.36	192.168.0.4	443,19839	https > 19839 [ACK] Seq=1 Ack=47 Win=361 Len=0
	216.58.220.36	192.168.0.4	443,19839	Application Data
	216.58.220.36	192.168.0.4	443,19839	https > 19839 [FIN, ACK] Seq=61 Ack=47 Win=361 Len=0
	192.168.0.4	216.58.220.36	19839,443	19839 > https [ACK] Seq=47 Ack=62 Win=64 Len=0
	216.58.220.36	192.168.0.4	443,19843	https > 19843 [ACK] Seq=1 Ack=47 Win=352 Len=0
	216.58.220.36	192.168.0.4	443,19843	Application Data
	216.58.220.36	192.168.0.4	443,19843	https > 19843 [FIN, ACK] Seq=61 Ack=47 Win=352 Len=0
	173.241.248.219	192.168.0.4	80,19898	http > 19898 [SYN, ACK] Seq=0 Ack=1 Win=29200 Len=0 MSS=1380 SACK_PERM=1 WS=512
	173.241.248.219	192.168.0.4	80,19899	http > 19899 [SYN, ACK] Seq=0 Ack=1 Win=29200 Len=0 MSS=1380 SACK_PERM=1 WS=512
	192.168.0.4	216.58.220.36	19843,443	19843 > https [ACK] Seq=47 Ack=62 Win=63 Len=0
	192.168.0.4	173.241.248.219	19898,80	19898 > http [ACK] Seq=1 Ack=1 Win=16384 Len=0
	192.168.0.4	173.241.248.219	19899,80	19899 > http [ACK] Seq=1 Ack=1 Win=16384 Len=0
	192.168.0.1	192.168.0.4		Standard query response 0xa553  CNAME akamai-edge.quantserve.com.akadns.net CNAME edge.quantserve.com.edgesuite.net CNAME a1811.g.akamai.net A 180.149.59.161 A 180.149.59.138
	192.168.0.1	192.168.0.4		Standard query response 0x25a5  CNAME akamai-edge.quantserve.com.akadns.net CNAME edge.quantserve.com.edgesuite.net CNAME a1811.g.akamai.net A 180.149.59.138 A 180.149.59.161
	192.168.0.4	216.58.220.36	19843,443	Application Data
	192.168.0.4	216.58.220.36	19839,443	Application Data
	192.168.0.4	216.58.220.36	19839,443	Encrypted Alert
	192.168.0.4	216.58.220.36	19839,443	19839 > https [FIN, ACK] Seq=124 Ack=62 Win=64 Len=0
	192.168.0.4	216.58.220.36	19843,443	Encrypted Alert
	192.168.0.4	216.58.220.36	19843,443	19843 > https [FIN, ACK] Seq=124 Ack=62 Win=63 Len=0
	192.168.0.4	180.149.59.161	19906,80	19906 > http [SYN] Seq=0 Win=8192 Len=0 MSS=1460 WS=256 SACK_PERM=1
	192.168.0.4	216.58.196.10	19890,80	19890 > http [ACK] Seq=339 Ack=33271 Win=16128 Len=0
	192.168.0.4	173.194.36.78	19834,80	[TCP segment of a reassembled PDU]
	192.168.0.4	239.255.255.250		M-SEARCH * HTTP/1.1 
	192.168.0.1	192.168.0.4		HTTP/1.1 200 OK 
	54.230.128.2	192.168.0.4	80,19900	http > 19900 [SYN, ACK] Seq=0 Ack=1 Win=14600 Len=0 MSS=1380 SACK_PERM=1 WS=256
	192.168.0.4	54.230.128.2	19900,80	19900 > http [ACK] Seq=1 Ack=1 Win=16384 Len=0
	54.230.128.2	192.168.0.4	80,19901	http > 19901 [SYN, ACK] Seq=0 Ack=1 Win=14600 Len=0 MSS=1380 SACK_PERM=1 WS=256
	192.168.0.4	54.230.128.2	19901,80	19901 > http [ACK] Seq=1 Ack=1 Win=16384 Len=0
	54.230.128.2	192.168.0.4	80,19902	http > 19902 [SYN, ACK] Seq=0 Ack=1 Win=14600 Len=0 MSS=1380 SACK_PERM=1 WS=256
	192.168.0.4	54.230.128.2	19902,80	19902 > http [ACK] Seq=1 Ack=1 Win=16384 Len=0
	54.230.128.2	192.168.0.4	80,19903	http > 19903 [SYN, ACK] Seq=0 Ack=1 Win=14600 Len=0 MSS=1380 SACK_PERM=1 WS=256
	192.168.0.4	54.230.128.2	19903,80	19903 > http [ACK] Seq=1 Ack=1 Win=16384 Len=0
	54.230.129.151	192.168.0.4	80,19904	http > 19904 [SYN, ACK] Seq=0 Ack=1 Win=14600 Len=0 MSS=1380 SACK_PERM=1 WS=256
	192.168.0.4	54.230.129.151	19904,80	19904 > http [ACK] Seq=1 Ack=1 Win=16384 Len=0
	192.168.0.4	173.241.248.219	19899,80	GET /w/1.0/jstag HTTP/1.1 
	180.149.59.161	192.168.0.4	80,19906	http > 19906 [SYN, ACK] Seq=0 Ack=1 Win=14600 Len=0 MSS=1380 SACK_PERM=1 WS=32
	192.168.0.4	180.149.59.161	19906,80	19906 > http [ACK] Seq=1 Ack=1 Win=16384 Len=0
	198.41.214.7	192.168.0.4	80,19892	[TCP segment of a reassembled PDU]
	192.168.0.4	173.241.248.219	19907,80	19907 > http [SYN] Seq=0 Win=8192 Len=0 MSS=1460 WS=256 SACK_PERM=1
	192.168.0.4	173.241.248.219	19908,80	19908 > http [SYN] Seq=0 Win=8192 Len=0 MSS=1460 WS=256 SACK_PERM=1
	198.41.214.7	192.168.0.4	80,19892	[TCP segment of a reassembled PDU]
	192.168.0.4	198.41.214.7	19892,80	19892 > http [ACK] Seq=350 Ack=2761 Win=16384 Len=0
	198.41.214.7	192.168.0.4	80,19892	[TCP segment of a reassembled PDU]
	198.41.214.7	192.168.0.4	80,19892	[TCP segment of a reassembled PDU]
	198.41.214.7	192.168.0.4	80,19892	HTTP/1.1 200 OK  (application/javascript)
	192.168.0.4	198.41.214.7	19892,80	19892 > http [ACK] Seq=350 Ack=5428 Win=16384 Len=0
	173.194.36.78	192.168.0.4	80,19834	http > 19834 [ACK] Seq=1 Ack=2 Win=344 Len=0 SLE=1 SRE=2
	216.58.220.36	192.168.0.4	443,19843	https > 19843 [RST] Seq=62 Win=0 Len=0
	216.58.220.36	192.168.0.4	443,19839	https > 19839 [RST] Seq=62 Win=0 Len=0
	54.230.128.2	192.168.0.4	80,19905	http > 19905 [SYN, ACK] Seq=0 Ack=1 Win=14600 Len=0 MSS=1380 SACK_PERM=1 WS=256
	192.168.0.4	54.230.128.2	19905,80	19905 > http [ACK] Seq=1 Ack=1 Win=16384 Len=0
	198.41.214.7	192.168.0.4	80,19892	[TCP Retransmission] http > 19892 [ACK] Seq=1 Ack=350 Win=30720 Len=1380
	54.230.128.2	192.168.0.4	80,19893	http > 19893 [ACK] Seq=1 Ack=371 Win=15872 Len=0
	192.168.0.4	198.41.214.7	19892,80	[TCP Dup ACK 236#1] 19892 > http [ACK] Seq=350 Ack=5428 Win=16384 Len=0 SLE=1 SRE=1381
	54.230.128.2	192.168.0.4	80,19893	[TCP segment of a reassembled PDU]
	192.168.0.4	180.149.59.161	19906,80	GET /quant.js HTTP/1.1 
	54.230.128.2	192.168.0.4	80,19893	[TCP segment of a reassembled PDU]
	192.168.0.4	54.230.128.2	19893,80	19893 > http [ACK] Seq=371 Ack=2761 Win=16384 Len=0
	54.230.128.2	192.168.0.4	80,19893	[TCP segment of a reassembled PDU]
	54.230.128.2	192.168.0.4	80,19893	[TCP segment of a reassembled PDU]
	192.168.0.4	54.230.128.2	19893,80	19893 > http [ACK] Seq=371 Ack=5521 Win=16384 Len=0
	54.230.128.2	192.168.0.4	80,19893	[TCP segment of a reassembled PDU]
	54.230.128.2	192.168.0.4	80,19893	[TCP segment of a reassembled PDU]
	192.168.0.4	54.230.128.2	19893,80	19893 > http [ACK] Seq=371 Ack=8281 Win=16384 Len=0
	54.230.128.2	192.168.0.4	80,19893	[TCP segment of a reassembled PDU]
	54.230.128.2	192.168.0.4	80,19893	[TCP segment of a reassembled PDU]
	192.168.0.4	54.230.128.2	19893,80	19893 > http [ACK] Seq=371 Ack=11041 Win=16384 Len=0
	54.230.128.2	192.168.0.4	80,19893	[TCP segment of a reassembled PDU]
	54.230.128.2	192.168.0.4	80,19893	[TCP segment of a reassembled PDU]
	192.168.0.4	54.230.128.2	19893,80	19893 > http [ACK] Seq=371 Ack=13801 Win=16384 Len=0
	54.230.128.2	192.168.0.4	80,19894	http > 19894 [ACK] Seq=1 Ack=352 Win=15872 Len=0
	54.230.128.2	192.168.0.4	80,19894	[TCP segment of a reassembled PDU]
	54.230.128.2	192.168.0.4	80,19894	[TCP segment of a reassembled PDU]
	192.168.0.4	54.230.128.2	19894,80	19894 > http [ACK] Seq=352 Ack=2761 Win=16384 Len=0
	54.230.128.2	192.168.0.4	80,19894	[TCP segment of a reassembled PDU]
	54.230.128.2	192.168.0.4	80,19894	HTTP/1.1 200 OK  (application/javascript)
	192.168.0.4	54.230.128.2	19894,80	19894 > http [ACK] Seq=352 Ack=5403 Win=16384 Len=0
	192.168.0.1	192.168.0.4		Standard query response 0xca15  CNAME 2-01-2cd3-000f.cdx.cedexis.net CNAME jsdelivr-cb7.kxcdn.com CNAME p-sgsg00.kxcdn.com A 119.81.66.229
	54.230.128.2	192.168.0.4	80,19895	http > 19895 [ACK] Seq=1 Ack=355 Win=15872 Len=0
	192.168.0.1	192.168.0.4		Standard query response 0xbe93  CNAME 2-01-2cd3-000f.cdx.cedexis.net CNAME jsdelivr-cb7.kxcdn.com CNAME p-sgsg00.kxcdn.com A 119.81.66.229
	180.149.59.161	192.168.0.4	80,19906	http > 19906 [ACK] Seq=1 Ack=310 Win=15680 Len=0
	198.41.214.7	192.168.0.4	80,19892	[TCP Retransmission] http > 19892 [ACK] Seq=2761 Ack=350 Win=30720 Len=1380[Reassembly error, protocol TCP: New fragment overlaps old data (retransmission?)]
	192.168.0.4	198.41.214.7	19892,80	[TCP Dup ACK 236#2] 19892 > http [ACK] Seq=350 Ack=5428 Win=16384 Len=0 SLE=2761 SRE=4141
	192.168.0.4	119.81.66.229	19909,80	19909 > http [SYN] Seq=0 Win=8192 Len=0 MSS=1460 WS=256 SACK_PERM=1
	180.149.59.161	192.168.0.4	80,19906	[TCP segment of a reassembled PDU]
	180.149.59.161	192.168.0.4	80,19906	[TCP segment of a reassembled PDU]
	192.168.0.4	180.149.59.161	19906,80	19906 > http [ACK] Seq=310 Ack=2761 Win=16384 Len=0
	180.149.59.161	192.168.0.4	80,19906	HTTP/1.1 200 OK  (application/x-javascript)
	54.230.128.2	192.168.0.4	80,19895	HTTP/1.1 200 OK  (application/javascript)
	52.11.218.52	192.168.0.4	443,19837	Encrypted Alert
	173.241.248.219	192.168.0.4	80,19899	http > 19899 [ACK] Seq=1 Ack=311 Win=30720 Len=0
	173.241.248.219	192.168.0.4	80,19899	HTTP/1.1 204 No Content 
	173.241.248.219	192.168.0.4	80,19899	http > 19899 [FIN, ACK] Seq=126 Ack=311 Win=30720 Len=0
	173.241.248.219	192.168.0.4	80,19907	http > 19907 [SYN, ACK] Seq=0 Ack=1 Win=29200 Len=0 MSS=1380 SACK_PERM=1 WS=512
	173.241.248.219	192.168.0.4	80,19908	http > 19908 [SYN, ACK] Seq=0 Ack=1 Win=29200 Len=0 MSS=1380 SACK_PERM=1 WS=512
	192.168.0.4	173.241.248.219	19899,80	19899 > http [ACK] Seq=311 Ack=127 Win=16384 Len=0
	192.168.0.4	173.241.248.219	19907,80	19907 > http [ACK] Seq=1 Ack=1 Win=16384 Len=0
	192.168.0.4	173.241.248.219	19908,80	19908 > http [ACK] Seq=1 Ack=1 Win=16384 Len=0
	192.168.0.4	52.11.218.52	19837,443	19837 > https [FIN, ACK] Seq=1 Ack=32 Win=15259 Len=0
	192.168.0.4	180.149.59.161	19906,80	19906 > http [ACK] Seq=310 Ack=3390 Win=15872 Len=0
	54.230.128.2	192.168.0.4	80,19893	[TCP segment of a reassembled PDU]
	192.168.0.4	173.241.248.219	19899,80	19899 > http [FIN, ACK] Seq=311 Ack=127 Win=16384 Len=0
	54.230.128.2	192.168.0.4	80,19893	[TCP segment of a reassembled PDU]
	192.168.0.4	54.230.128.2	19893,80	19893 > http [ACK] Seq=371 Ack=16561 Win=16384 Len=0
	192.168.0.4	54.230.128.2	19895,80	19895 > http [ACK] Seq=355 Ack=1102 Win=15360 Len=0
	54.230.128.2	192.168.0.4	80,19893	HTTP/1.1 200 OK  (text/css)
	180.149.59.161	192.168.0.4	80,19906	[TCP Retransmission] http > 19906 [PSH, ACK] Seq=2761 Ack=310 Win=15680 Len=629[Reassembly error, protocol TCP: New fragment overlaps old data (retransmission?)]
	192.168.0.4	180.149.59.161	19906,80	[TCP Dup ACK 290#1] 19906 > http [ACK] Seq=310 Ack=3390 Win=15872 Len=0 SLE=2761 SRE=3390
	119.81.66.229	192.168.0.4	80,19909	http > 19909 [SYN, ACK] Seq=0 Ack=1 Win=29200 Len=0 MSS=1380 SACK_PERM=1 WS=512
	192.168.0.4	119.81.66.229	19909,80	19909 > http [ACK] Seq=1 Ack=1 Win=16384 Len=0
	192.168.0.4	54.230.128.2	19893,80	19893 > http [ACK] Seq=371 Ack=17150 Win=15872 Len=0
	192.168.0.4	54.230.129.151	19897,80	GET /assets/4395599/Israeli_territory_1949_to_1967_crop.jpg HTTP/1.1 
	192.168.0.4	54.230.129.151	19904,80	GET /assets/4395631/Durand_line_crop.jpg HTTP/1.1 
	192.168.0.4	54.230.129.198	19777,80	Continuation or non-HTTP traffic
	192.168.0.4	54.230.131.46	19769,80	GET /uploads/chorus_asset/file/658228/6a00d8341bfb1653ef017d3c49466d970c.0.png HTTP/1.1 
	192.168.0.4	192.168.0.1		Standard query 0x233f  A ajax.googleapis.com
	192.168.0.4	119.81.66.229	19909,80	GET /jquery.unveiljs/1.3.0/jquery.unveil.min.js HTTP/1.1 
	192.168.0.4	216.58.196.10	19890,80	GET /ajax/libs/jquery/1.10.2/jquery.min.map HTTP/1.1 
	192.168.0.4	192.168.0.1		Standard query 0x5cc6  A cdn2.vox-cdn.com
	192.168.0.4	54.230.129.151	19910,80	19910 > http [SYN] Seq=0 Win=8192 Len=0 MSS=1460 WS=256 SACK_PERM=1
	192.168.0.4	54.230.129.198	19911,80	19911 > http [SYN] Seq=0 Win=8192 Len=0 MSS=1460 WS=256 SACK_PERM=1
	192.168.0.1	192.168.0.4		Standard query response 0x233f  CNAME googleapis.l.google.com A 216.58.196.10
	173.241.248.219	192.168.0.4	80,19899	http > 19899 [ACK] Seq=127 Ack=312 Win=30720 Len=0
	192.168.0.1	192.168.0.4		Standard query response 0x5cc6  CNAME ddrgqsxlcy7wq.cloudfront.net A 54.230.131.46 A 54.192.128.31 A 54.192.128.61 A 54.192.128.118 A 54.192.129.19 A 54.192.130.179 A 54.230.129.151 A 54.230.129.198
	216.58.196.10	192.168.0.4	80,19890	[TCP segment of a reassembled PDU]
	216.58.196.10	192.168.0.4	80,19890	[TCP segment of a reassembled PDU]
	192.168.0.4	216.58.196.10	19890,80	19890 > http [ACK] Seq=721 Ack=36031 Win=16384 Len=0
	216.58.196.10	192.168.0.4	80,19890	[TCP segment of a reassembled PDU]
	216.58.196.10	192.168.0.4	80,19890	[TCP segment of a reassembled PDU]
	192.168.0.4	216.58.196.10	19890,80	19890 > http [ACK] Seq=721 Ack=38791 Win=16384 Len=0
	216.58.196.10	192.168.0.4	80,19890	[TCP segment of a reassembled PDU]
	216.58.196.10	192.168.0.4	80,19890	[TCP segment of a reassembled PDU]
	192.168.0.4	216.58.196.10	19890,80	19890 > http [ACK] Seq=721 Ack=41551 Win=16384 Len=0
	216.58.196.10	192.168.0.4	80,19890	[TCP segment of a reassembled PDU]
	216.58.196.10	192.168.0.4	80,19890	[TCP segment of a reassembled PDU]
	192.168.0.4	216.58.196.10	19890,80	19890 > http [ACK] Seq=721 Ack=44311 Win=16384 Len=0
	216.58.196.10	192.168.0.4	80,19890	[TCP segment of a reassembled PDU]
	216.58.196.10	192.168.0.4	80,19890	[TCP segment of a reassembled PDU]
	192.168.0.4	216.58.196.10	19890,80	19890 > http [ACK] Seq=721 Ack=47071 Win=16384 Len=0
	216.58.196.10	192.168.0.4	80,19890	[TCP segment of a reassembled PDU]
	216.58.196.10	192.168.0.4	80,19890	[TCP segment of a reassembled PDU]
	119.81.66.229	192.168.0.4	80,19909	http > 19909 [ACK] Seq=1 Ack=341 Win=30720 Len=0
	192.168.0.4	216.58.196.10	19890,80	19890 > http [ACK] Seq=721 Ack=49399 Win=16384 Len=0
	119.81.66.229	192.168.0.4	80,19909	HTTP/1.1 200 OK  (application/javascript)
	216.58.196.10	192.168.0.4	80,19890	[TCP segment of a reassembled PDU]
	216.58.196.10	192.168.0.4	80,19890	[TCP segment of a reassembled PDU]
	192.168.0.4	216.58.196.10	19890,80	19890 > http [ACK] Seq=721 Ack=52159 Win=16384 Len=0
	216.58.196.10	192.168.0.4	80,19890	[TCP segment of a reassembled PDU]
	54.230.129.151	192.168.0.4	80,19897	http > 19897 [ACK] Seq=1 Ack=383 Win=15872 Len=0
	54.230.129.151	192.168.0.4	80,19897	[TCP segment of a reassembled PDU]
	54.230.129.151	192.168.0.4	80,19897	[TCP segment of a reassembled PDU]
	192.168.0.4	54.230.129.151	19897,80	19897 > http [ACK] Seq=383 Ack=2761 Win=16384 Len=0
	54.230.129.151	192.168.0.4	80,19897	[TCP segment of a reassembled PDU]
	192.168.0.4	119.81.66.229	19909,80	19909 > http [ACK] Seq=341 Ack=978 Win=15616 Len=0
	54.230.129.151	192.168.0.4	80,19897	[TCP segment of a reassembled PDU]
	192.168.0.4	54.230.129.151	19897,80	19897 > http [ACK] Seq=383 Ack=5521 Win=16384 Len=0
	54.230.129.151	192.168.0.4	80,19897	[TCP segment of a reassembled PDU]
	192.168.0.4	54.230.129.151	19912,80	19912 > http [SYN] Seq=0 Win=8192 Len=0 MSS=1460 WS=256 SACK_PERM=1
	192.168.0.4	54.230.131.46	19913,80	19913 > http [SYN] Seq=0 Win=8192 Len=0 MSS=1460 WS=256 SACK_PERM=1
	192.168.0.4	216.58.196.10	19890,80	19890 > http [ACK] Seq=721 Ack=52415 Win=16128 Len=0
	54.230.129.151	192.168.0.4	80,19897	[TCP segment of a reassembled PDU]
	192.168.0.4	54.230.129.151	19897,80	19897 > http [ACK] Seq=383 Ack=8281 Win=16384 Len=0
	54.230.129.151	192.168.0.4	80,19897	[TCP segment of a reassembled PDU]
	54.230.129.151	192.168.0.4	80,19897	[TCP segment of a reassembled PDU]
	192.168.0.4	54.230.129.151	19897,80	19897 > http [ACK] Seq=383 Ack=11041 Win=16384 Len=0
	54.230.129.151	192.168.0.4	80,19897	[TCP segment of a reassembled PDU]
	54.230.129.151	192.168.0.4	80,19897	[TCP segment of a reassembled PDU]
	192.168.0.4	54.230.129.151	19897,80	19897 > http [ACK] Seq=383 Ack=13801 Win=16384 Len=0
	216.58.196.10	192.168.0.4	80,19890	[TCP segment of a reassembled PDU]
	54.230.129.151	192.168.0.4	80,19904	http > 19904 [ACK] Seq=1 Ack=364 Win=15872 Len=0
	216.58.196.10	192.168.0.4	80,19890	[TCP segment of a reassembled PDU]
	192.168.0.4	216.58.196.10	19890,80	19890 > http [ACK] Seq=721 Ack=55175 Win=16384 Len=0
	216.58.196.10	192.168.0.4	80,19890	[TCP segment of a reassembled PDU]
	54.230.129.198	192.168.0.4	80,19777	http > 19777 [ACK] Seq=1 Ack=379 Win=66 Len=0
	52.11.218.52	192.168.0.4	443,19837	https > 19837 [FIN, ACK] Seq=32 Ack=2 Win=12150 Len=0
	192.168.0.4	52.11.218.52	19837,443	19837 > https [ACK] Seq=2 Ack=33 Win=15259 Len=0
	54.230.131.46	192.168.0.4	80,19769	[TCP segment of a reassembled PDU]
	54.230.131.46	192.168.0.4	80,19769	[TCP segment of a reassembled PDU]
	192.168.0.4	54.230.131.46	19769,80	19769 > http [ACK] Seq=731 Ack=4810 Win=479 Len=0
	54.230.131.46	192.168.0.4	80,19769	[TCP segment of a reassembled PDU]
	54.230.131.46	192.168.0.4	80,19769	[TCP segment of a reassembled PDU]
	192.168.0.4	54.230.131.46	19769,80	19769 > http [ACK] Seq=731 Ack=7570 Win=587 Len=0
	192.168.0.4	216.58.196.10	19890,80	19890 > http [ACK] Seq=721 Ack=56299 Win=15360 Len=0
	216.58.196.10	192.168.0.4	80,19890	[TCP segment of a reassembled PDU]
	216.58.196.10	192.168.0.4	80,19890	[TCP segment of a reassembled PDU]
	192.168.0.4	216.58.196.10	19890,80	19890 > http [ACK] Seq=721 Ack=59059 Win=16384 Len=0
	216.58.196.10	192.168.0.4	80,19890	[TCP segment of a reassembled PDU]
	216.58.196.10	192.168.0.4	80,19890	[TCP segment of a reassembled PDU]
	192.168.0.4	216.58.196.10	19890,80	19890 > http [ACK] Seq=721 Ack=60695 Win=16384 Len=0
	216.58.196.10	192.168.0.4	80,19890	[TCP segment of a reassembled PDU]
	216.58.196.10	192.168.0.4	80,19890	[TCP segment of a reassembled PDU]
	54.230.129.151	192.168.0.4	80,19910	http > 19910 [SYN, ACK] Seq=0 Ack=1 Win=14600 Len=0 MSS=1380 SACK_PERM=1 WS=256
	54.230.129.198	192.168.0.4	80,19911	http > 19911 [SYN, ACK] Seq=0 Ack=1 Win=14600 Len=0 MSS=1380 SACK_PERM=1 WS=256
	192.168.0.4	216.58.196.10	19890,80	19890 > http [ACK] Seq=721 Ack=63199 Win=16384 Len=0
	192.168.0.4	54.230.129.151	19910,80	GET /assets/4395669/Afghanistan_politisch_1989_ENGLISH_crop.jpg HTTP/1.1 
	192.168.0.4	54.230.129.198	19911,80	19911 > http [ACK] Seq=1 Ack=1 Win=16384 Len=0
	192.168.0.4	54.230.129.198	19911,80	GET /assets/4395615/Iran_under_1900s_qajars_wikimedia_crop.jpg HTTP/1.1 
	216.58.196.10	192.168.0.4	80,19890	[TCP segment of a reassembled PDU]
	216.58.196.10	192.168.0.4	80,19890	[TCP segment of a reassembled PDU]
	192.168.0.4	216.58.196.10	19890,80	19890 > http [ACK] Seq=721 Ack=65783 Win=16384 Len=0
	216.58.196.10	192.168.0.4	80,19890	[TCP segment of a reassembled PDU]
	216.58.196.10	192.168.0.4	80,19890	[TCP segment of a reassembled PDU]
	192.168.0.4	216.58.196.10	19890,80	19890 > http [ACK] Seq=721 Ack=68543 Win=16384 Len=0
	54.230.129.151	192.168.0.4	80,19904	[TCP segment of a reassembled PDU]
	54.230.129.151	192.168.0.4	80,19904	[TCP segment of a reassembled PDU]
	192.168.0.4	54.230.129.151	19904,80	19904 > http [ACK] Seq=364 Ack=2761 Win=16384 Len=0
	54.230.129.151	192.168.0.4	80,19904	[TCP segment of a reassembled PDU]
	54.230.129.151	192.168.0.4	80,19904	[TCP segment of a reassembled PDU]
	192.168.0.4	54.230.129.151	19904,80	19904 > http [ACK] Seq=364 Ack=5521 Win=16384 Len=0
	54.230.129.151	192.168.0.4	80,19904	[TCP segment of a reassembled PDU]
	54.230.129.151	192.168.0.4	80,19904	[TCP segment of a reassembled PDU]
	192.168.0.4	54.230.129.151	19904,80	19904 > http [ACK] Seq=364 Ack=8281 Win=16384 Len=0
	54.230.129.151	192.168.0.4	80,19904	[TCP segment of a reassembled PDU]
	54.230.129.151	192.168.0.4	80,19904	[TCP segment of a reassembled PDU]
	192.168.0.4	54.230.129.151	19904,80	19904 > http [ACK] Seq=364 Ack=11041 Win=16384 Len=0
	54.230.129.151	192.168.0.4	80,19904	[TCP segment of a reassembled PDU]
	54.230.129.151	192.168.0.4	80,19904	[TCP segment of a reassembled PDU]
	192.168.0.4	54.230.129.151	19904,80	19904 > http [ACK] Seq=364 Ack=13801 Win=16384 Len=0
	54.230.129.198	192.168.0.4	80,19777	[TCP segment of a reassembled PDU]
	54.230.129.198	192.168.0.4	80,19777	[TCP segment of a reassembled PDU]
	192.168.0.6	192.168.0.4	62864,41440	62864 > 41440 [PSH, ACK] Seq=1 Ack=1 Win=4188 Len=69
	192.168.0.4	54.230.129.198	19777,80	19777 > http [ACK] Seq=379 Ack=2761 Win=264 Len=0
	54.230.129.198	192.168.0.4	80,19777	[TCP segment of a reassembled PDU]
	216.58.196.10	192.168.0.4	80,19890	[TCP segment of a reassembled PDU]
	216.58.196.10	192.168.0.4	80,19890	[TCP segment of a reassembled PDU]
	192.168.0.4	216.58.196.10	19890,80	19890 > http [ACK] Seq=721 Ack=70099 Win=16384 Len=0
	216.58.196.10	192.168.0.4	80,19890	[TCP segment of a reassembled PDU]
	216.58.196.10	192.168.0.4	80,19890	[TCP segment of a reassembled PDU]
	192.168.0.4	216.58.196.10	19890,80	19890 > http [ACK] Seq=721 Ack=71659 Win=16384 Len=0
	54.230.129.151	192.168.0.4	80,19897	[TCP segment of a reassembled PDU]
	192.168.0.4	192.168.0.6	41440,62864	41440 > 62864 [ACK] Seq=1 Ack=70 Win=67 Len=0
	54.230.129.151	192.168.0.4	80,19897	[TCP segment of a reassembled PDU]
	192.168.0.4	54.230.129.151	19897,80	19897 > http [ACK] Seq=383 Ack=16561 Win=16384 Len=0
	54.230.129.151	192.168.0.4	80,19897	[TCP segment of a reassembled PDU]
	192.168.0.4	54.230.129.198	19777,80	19777 > http [ACK] Seq=379 Ack=4141 Win=264 Len=0
	54.230.129.151	192.168.0.4	80,19897	[TCP segment of a reassembled PDU]
	192.168.0.4	54.230.129.151	19897,80	19897 > http [ACK] Seq=383 Ack=19321 Win=16384 Len=0
	54.230.129.151	192.168.0.4	80,19897	[TCP segment of a reassembled PDU]
	216.58.196.10	192.168.0.4	80,19890	[TCP segment of a reassembled PDU]
	216.58.196.10	192.168.0.4	80,19890	[TCP segment of a reassembled PDU]
	192.168.0.4	216.58.196.10	19890,80	19890 > http [ACK] Seq=721 Ack=74419 Win=16384 Len=0
	216.58.196.10	192.168.0.4	80,19890	[TCP segment of a reassembled PDU]
	54.230.131.46	192.168.0.4	80,19913	http > 19913 [SYN, ACK] Seq=0 Ack=1 Win=14600 Len=0 MSS=1380 SACK_PERM=1 WS=256
	54.230.129.151	192.168.0.4	80,19912	http > 19912 [SYN, ACK] Seq=0 Ack=1 Win=14600 Len=0 MSS=1380 SACK_PERM=1 WS=256
	192.168.0.4	54.230.131.46	19913,80	19913 > http [ACK] Seq=1 Ack=1 Win=16384 Len=0
	192.168.0.4	54.230.129.151	19912,80	19912 > http [ACK] Seq=1 Ack=1 Win=16384 Len=0
	216.58.196.10	192.168.0.4	80,19890	[TCP segment of a reassembled PDU]
	192.168.0.4	216.58.196.10	19890,80	19890 > http [ACK] Seq=721 Ack=76823 Win=16384 Len=0
	216.58.196.10	192.168.0.4	80,19890	[TCP segment of a reassembled PDU]
	216.58.196.10	192.168.0.4	80,19890	[TCP segment of a reassembled PDU]
	192.168.0.4	216.58.196.10	19890,80	19890 > http [ACK] Seq=721 Ack=78379 Win=16384 Len=0
	216.58.196.10	192.168.0.4	80,19890	[TCP segment of a reassembled PDU]
	192.168.0.4	54.230.131.46	19774,80	[TCP segment of a reassembled PDU]
	192.168.0.4	23.206.117.153	19824,443	Continuation Data
	192.168.0.4	54.230.129.151	19897,80	19897 > http [ACK] Seq=383 Ack=20701 Win=74496 Len=0
	54.230.129.151	192.168.0.4	80,19897	[TCP segment of a reassembled PDU]
	54.230.129.151	192.168.0.4	80,19897	[TCP segment of a reassembled PDU]
	192.168.0.4	54.230.129.151	19897,80	19897 > http [ACK] Seq=383 Ack=23461 Win=72960 Len=0
	54.230.129.151	192.168.0.4	80,19897	[TCP segment of a reassembled PDU]
	54.230.129.151	192.168.0.4	80,19897	[TCP segment of a reassembled PDU]
	192.168.0.4	54.230.129.151	19897,80	19897 > http [ACK] Seq=383 Ack=26221 Win=72960 Len=0
	192.168.0.4	216.58.196.10	19890,80	19890 > http [ACK] Seq=721 Ack=79583 Win=15360 Len=0
	54.230.129.151	192.168.0.4	80,19897	[TCP segment of a reassembled PDU]
	216.58.196.10	192.168.0.4	80,19890	[TCP segment of a reassembled PDU]
	216.58.196.10	192.168.0.4	80,19890	[TCP segment of a reassembled PDU]
	192.168.0.4	216.58.196.10	19890,80	19890 > http [ACK] Seq=721 Ack=82167 Win=16384 Len=0
